{
  "tag": "日本百名山",
  "source": "Wikipedia「日本百名山」著書順の山の一覧（2026-10-10 参照） https://ja.wikipedia.org/w/index.php?title=日本百名山&oldid=111092405",
  "license": "山名一覧: CC BY-SA 4.0 https://creativecommons.org/licenses/by-sa/4.0/ ; 照合に用いた OpenStreetMap データ: ODbL 1.0 https://opendatacommons.org/licenses/odbl/1-0/",
  "attribution": "Wikipedia「日本百名山」の投稿者 https://ja.wikipedia.org/w/index.php?title=日本百名山&action=history ; © OpenStreetMap contributors https://www.openstreetmap.org/copyright",
  "changes": "一覧の著書順を保持し、各山を代表する山頂 1 地点に OpenStreetMap の osmId を付与した。山群は主峰または最高峰を選び、飯豊山は飯豊本山、那須岳は茶臼岳、丹沢山は丹沢山を採用した。name は照合した osm-peaks の表示名に合わせた。山群・別名と採用した山頂の対応は同じフォルダの README.md に記載。",
  "points": [
    {
      "osmId": 1366603241,
      "name": "利尻山"
    },
    {
      "osmId": 1366603243,
      "name": "羅臼岳"
    },
    {
      "osmId": 1366603214,
      "name": "斜里岳"
    },
    {
      "osmId": 1366603211,
      "name": "雌阿寒岳"
    },
    {
      "osmId": 811793558,
      "name": "旭岳"
    },
    {
      "osmId": 1366603238,
      "name": "トムラウシ山"
    },
    {
      "osmId": 1366603231,
      "name": "十勝岳"
    },
    {
      "osmId": 1366603199,
      "name": "幌尻岳"
    },
    {
      "osmId": 204683948,
      "name": "羊蹄山"
    },
    {
      "osmId": 4382929357,
      "name": "岩木山"
    },
    {
      "osmId": 3258247280,
      "name": "大岳"
    },
    {
      "osmId": 3259131479,
      "name": "八幡平"
    },
    {
      "osmId": 5214573299,
      "name": "岩手山"
    },
    {
      "osmId": 3259271873,
      "name": "早池峰山"
    },
    {
      "osmId": 1344157430,
      "name": "鳥海山"
    },
    {
      "osmId": 3259293973,
      "name": "月山"
    },
    {
      "osmId": 3259293971,
      "name": "大朝日岳"
    },
    {
      "osmId": 3259286462,
      "name": "熊野岳"
    },
    {
      "osmId": 366103279,
      "name": "飯豊山"
    },
    {
      "osmId": 3259600542,
      "name": "西吾妻山"
    },
    {
      "osmId": 314604464,
      "name": "安達太良山"
    },
    {
      "osmId": 314604715,
      "name": "磐梯山"
    },
    {
      "osmId": 3259600548,
      "name": "会津駒ヶ岳"
    },
    {
      "osmId": 3260851378,
      "name": "茶臼岳"
    },
    {
      "osmId": 3261275254,
      "name": "駒ヶ岳"
    },
    {
      "osmId": 3261275223,
      "name": "平ヶ岳"
    },
    {
      "osmId": 1275890209,
      "name": "巻機山"
    },
    {
      "osmId": 4360109215,
      "name": "燧ヶ岳"
    },
    {
      "osmId": 1362332367,
      "name": "至仏山"
    },
    {
      "osmId": 3261275245,
      "name": "谷川岳 オキノ耳"
    },
    {
      "osmId": 3261275250,
      "name": "雨飾山"
    },
    {
      "osmId": 3261275240,
      "name": "苗場山"
    },
    {
      "osmId": 3156235450,
      "name": "妙高山"
    },
    {
      "osmId": 3156235451,
      "name": "火打山"
    },
    {
      "osmId": 3261275255,
      "name": "高妻山"
    },
    {
      "osmId": 3684227754,
      "name": "男体山"
    },
    {
      "osmId": 3260851383,
      "name": "日光白根山"
    },
    {
      "osmId": 3260851390,
      "name": "皇海山"
    },
    {
      "osmId": 3261275233,
      "name": "武尊山"
    },
    {
      "osmId": 1817309009,
      "name": "黒檜山"
    },
    {
      "osmId": 1116288159,
      "name": "本白根山"
    },
    {
      "osmId": 3757330948,
      "name": "四阿山"
    },
    {
      "osmId": 510162677,
      "name": "浅間山"
    },
    {
      "osmId": 3259610769,
      "name": "筑波山"
    },
    {
      "osmId": 3268400982,
      "name": "白馬岳"
    },
    {
      "osmId": 3268398655,
      "name": "五竜岳"
    },
    {
      "osmId": 3268401000,
      "name": "鹿島槍ヶ岳"
    },
    {
      "osmId": 3268398660,
      "name": "剱岳"
    },
    {
      "osmId": 7936580885,
      "name": "大汝山"
    },
    {
      "osmId": 3268400986,
      "name": "薬師岳"
    },
    {
      "osmId": 3268401001,
      "name": "黒部五郎岳"
    },
    {
      "osmId": 3268400973,
      "name": "水晶岳"
    },
    {
      "osmId": 3268400999,
      "name": "鷲羽岳"
    },
    {
      "osmId": 582994395,
      "name": "槍ヶ岳"
    },
    {
      "osmId": 165028676,
      "name": "奥穂高岳"
    },
    {
      "osmId": 1954353628,
      "name": "常念岳"
    },
    {
      "osmId": 3786299727,
      "name": "笠ヶ岳"
    },
    {
      "osmId": 4318282024,
      "name": "焼岳"
    },
    {
      "osmId": 1851367347,
      "name": "剣ヶ峰"
    },
    {
      "osmId": 1851342877,
      "name": "御嶽山"
    },
    {
      "osmId": 1150839523,
      "name": "王ヶ頭"
    },
    {
      "osmId": 1140877707,
      "name": "車山"
    },
    {
      "osmId": 2933768500,
      "name": "蓼科山"
    },
    {
      "osmId": 1827243160,
      "name": "赤岳"
    },
    {
      "osmId": 3259820851,
      "name": "両神山"
    },
    {
      "osmId": 531000790,
      "name": "雲取山"
    },
    {
      "osmId": 625549447,
      "name": "甲武信ヶ岳"
    },
    {
      "osmId": 1738405873,
      "name": "金峰山"
    },
    {
      "osmId": 1738405858,
      "name": "瑞牆山"
    },
    {
      "osmId": 705063479,
      "name": "大菩薩嶺"
    },
    {
      "osmId": 1512981907,
      "name": "丹沢山"
    },
    {
      "osmId": 714354378,
      "name": "富士山"
    },
    {
      "osmId": 3403990450,
      "name": "万三郎岳"
    },
    {
      "osmId": 2427789612,
      "name": "駒ヶ岳"
    },
    {
      "osmId": 1280981687,
      "name": "空木岳"
    },
    {
      "osmId": 3268833185,
      "name": "恵那山"
    },
    {
      "osmId": 3268833205,
      "name": "駒ヶ岳"
    },
    {
      "osmId": 823252811,
      "name": "仙丈ヶ岳"
    },
    {
      "osmId": 612137642,
      "name": "観音ヶ岳"
    },
    {
      "osmId": 1851312843,
      "name": "北岳"
    },
    {
      "osmId": 3802063955,
      "name": "間ノ岳"
    },
    {
      "osmId": 10959833291,
      "name": "塩見岳 東峰"
    },
    {
      "osmId": 1851329514,
      "name": "悪沢岳"
    },
    {
      "osmId": 10803747704,
      "name": "赤石岳"
    },
    {
      "osmId": 1851381054,
      "name": "聖岳"
    },
    {
      "osmId": 3268833172,
      "name": "光岳"
    },
    {
      "osmId": 1821390107,
      "name": "白山"
    },
    {
      "osmId": 3265266871,
      "name": "荒島岳"
    },
    {
      "osmId": 1852020523,
      "name": "伊吹山"
    },
    {
      "osmId": 530641929,
      "name": "日出ケ岳"
    },
    {
      "osmId": 2487512590,
      "name": "八経ヶ岳"
    },
    {
      "osmId": 1852017246,
      "name": "剣ヶ峰"
    },
    {
      "osmId": 1399301405,
      "name": "剣山"
    },
    {
      "osmId": 1851999692,
      "name": "石鎚山"
    },
    {
      "osmId": 1691773450,
      "name": "中岳"
    },
    {
      "osmId": 740635692,
      "name": "祖母山"
    },
    {
      "osmId": 917987459,
      "name": "高岳"
    },
    {
      "osmId": 1852101595,
      "name": "韓国岳"
    },
    {
      "osmId": 8050918563,
      "name": "開聞岳"
    },
    {
      "osmId": 987483084,
      "name": "宮之浦岳"
    }
  ]
}
